{
  "$schema": "../docs/creature-schema-v1.json",
  "schema": "encounterpp-creature",
  "schemaVersion": 1,
  "id": "goblin",
  "name": "Goblin",
  "size": "Small",
  "type": {
    "type": "humanoid",
    "tags": ["goblinoid"]
  },
  "alignment": "neutral evil",
  "ac": [
    {
      "value": 15,
      "notes": "leather armor, shield"
    }
  ],
  "hp": {
    "average": 7,
    "formula": "2d6"
  },
  "speed": {
    "walk": 30
  },
  "abilities": {
    "str": 8,
    "dex": 14,
    "con": 10,
    "int": 10,
    "wis": 8,
    "cha": 8
  },
  "savingThrows": {},
  "skills": {
    "stealth": 6
  },
  "senses": {
    "darkvision": 60,
    "passivePerception": 9
  },
  "languages": ["Common", "Goblin"],
  "cr": 0.25,
  "xp": 50,
  "proficiencies": {
    "armor": [],
    "weapons": [],
    "tools": []
  },
  "damageVulnerabilities": [],
  "damageResistances": [],
  "damageImmunities": [],
  "conditionImmunities": [],
  "traits": [
    {
      "name": "Nimble Escape",
      "desc": "The goblin can take the Disengage or Hide action as a bonus action on each of its turns."
    }
  ],
  "actions": [
    {
      "name": "Scimitar",
      "type": "meleeWeaponAttack",
      "attackBonus": 4,
      "reach": 5,
      "target": "one target",
      "onHit": [
        {
          "damage": "1d6+2",
          "type": "slashing"
        }
      ]
    },
    {
      "name": "Shortbow",
      "type": "rangedWeaponAttack",
      "attackBonus": 4,
      "range": {
        "normal": 80,
        "long": 320
      },
      "target": "one target",
      "onHit": [
        {
          "damage": "1d6+2",
          "type": "piercing"
        }
      ]
    }
  ],
  "bonusActions": [],
  "reactions": [],
  "legendary": null,
  "lairActions": [],
  "spellcasting": [],
  "meta": {
    "source": "5e SRD",
    "imageUrl": null,
    "tags": ["srd"]
  }
}
